{
  "generated_at": "2026-10-02T03:18:38.261863Z",
  "outputs": {
    "architecture/overview.md": {
      "input_revision": "546c5cbbaf757bf950378556e65d5a4f5ae9f84072abd3363d5eb78a2f504218",
      "output_digest": "sha256:123a8ecc1aceb2fc298c5e7a456ecc0605aaeb9c5af94eccaa1b9892224e9d25",
      "owner_ref": "resource://architecture/overview",
      "renderer": "markdown",
      "renderer_revision": "builtin:markdown:v1",
      "resource_kind": "managed"
    },
    "architecture/system_summary.md": {
      "input_revision": "8280937b5ac0b8ef86f936343319444a7ce9204a42cfbf4e2ce8bcab7e2a773b",
      "output_digest": "sha256:0f6885d6dc37bdc5e43eb1be70f990a83af8d5e50c65ed02eb8c1cab6eaf4eb2",
      "owner_ref": "resource://architecture/system_summary",
      "renderer": "markdown",
      "renderer_revision": "builtin:markdown:v1",
      "resource_kind": "derived"
    },
    "policies/method_policy.md": {
      "input_revision": "c3f9b20056347ac2a11cde64cc95fa259704424019fa44f2433fa65f979663ab",
      "output_digest": "sha256:002576ad11def446ef7123a0d1ccf61df8440707eef9e45432a6b99a8bad524e",
      "owner_ref": "resource://policies/method_policy",
      "renderer": "markdown",
      "renderer_revision": "builtin:markdown:v1",
      "resource_kind": "managed"
    }
  },
  "state_revision": 1,
  "state_schema_version": "1.0.0"
}
